{
  "protocol": "layrs.sync.v3",
  "type": "syncTransactionRequest",
  "spaceId": "space:demo",
  "clientId": "client:desktop-a",
  "idempotencyKey": "policy-change-001",
  "requestDigest": "blake3:bbbbbbbbbbbbbbbbbbbbbbbbbbbbbbbbbbbbbbbbbbbbbbbbbbbbbbbbbbbbbbbb",
  "knownEventCursor": "cursor-demo-0",
  "steps": [],
  "observations": [],
  "products": [],
  "viewMutation": null,
  "policyRootMutation": {
    "mutationId": "mutation:policy-1",
    "expectedPolicySetId": "blake3:4444444444444444444444444444444444444444444444444444444444444444",
    "expectedAuthorizationEpoch": 1,
    "proposedPolicySet": {
      "kind": "stored",
      "policySetId": "blake3:aaaaaaaaaaaaaaaaaaaaaaaaaaaaaaaaaaaaaaaaaaaaaaaaaaaaaaaaaaaaaaaa"
    }
  }
}
